{
  "$schema": "https://json-schema.org/draft/2020-12/schema",
  "$id": "https://trumatics.local/contracts/observation-event.schema.json",
  "title": "ObservationEvent",
  "description": "Canonical, immutable record of one model invocation — Observation Protocol v1. The single contract every producer emits and every analytics module consumes; storage sinks (JSONL, DB, etc.) serialize and yield this shape via the EventSource interface. This schema is kept in lockstep with the SDK validators and the shared conformance fixtures (protocol/conformance/); see docs/adr/0002 and docs/adr/0004.",
  "type": "object",
  "additionalProperties": false,
  "required": [
    "event_id",
    "timestamp",
    "provider",
    "model",
    "request_id",
    "session_id",
    "agent",
    "prompt",
    "input_tokens",
    "output_tokens",
    "total_tokens",
    "latency_ms",
    "cost",
    "currency",
    "status",
    "attribution_status",
    "metadata"
  ],
  "properties": {
    "event_id": {
      "type": "string",
      "minLength": 1,
      "description": "Stable unique id; deduplication key. Legacy records receive a deterministic content-hash id."
    },
    "timestamp": {
      "type": "string",
      "description": "ISO-8601 timestamp of the invocation; ordering key for trends and sessions."
    },
    "provider": { "type": "string", "minLength": 1 },
    "model": { "type": "string", "minLength": 1 },
    "request_id": {
      "type": "string",
      "minLength": 1,
      "description": "Underlying model request / round-trip id (ADK invocation-derived)."
    },
    "session_id": {
      "type": "string",
      "minLength": 1,
      "description": "Session/conversation grouping. Legacy events use the sentinel 'unknown'."
    },
    "conversation_id": {
      "type": ["string", "null"],
      "description": "Optional finer-grained conversation thread within a session."
    },
    "workflow_id": {
      "type": ["string", "null"],
      "description": "Optional workflow/invocation grouping."
    },
    "agent": {
      "type": "string",
      "minLength": 1,
      "description": "Producing agent. Legacy default 'unknown'."
    },
    "parent_agent": {
      "type": ["string", "null"],
      "description": "Parent agent in the execution hierarchy (coordinator → sub-agent); null for a root. The agent execution tree is derived from these edges plus tool_name."
    },
    "prompt": {
      "type": "string",
      "minLength": 1,
      "description": "Attributed prompt (tokenhelm-prompt scope). Legacy default 'unknown'."
    },
    "prompt_hash": {
      "type": ["string", "null"],
      "description": "Hash of resolved prompt text; groups identical prompts."
    },
    "prompt_version": {
      "type": ["string", "null"],
      "description": "Tracked prompt version for regression detection."
    },
    "tool_name": {
      "type": ["string", "null"],
      "description": "Tool invoked on this round-trip, if any."
    },
    "input_tokens": { "type": "integer", "minimum": 0 },
    "output_tokens": {
      "type": "integer",
      "minimum": 0,
      "description": "Includes folded thinking/reasoning tokens (project tracking rule)."
    },
    "total_tokens": {
      "type": "integer",
      "minimum": 0,
      "description": "As recorded upstream; may exceed input+output."
    },
    "latency_ms": { "type": "number", "minimum": 0 },
    "cost": {
      "type": "string",
      "pattern": "^[0-9]+(\\.[0-9]+)?$",
      "description": "Decimal string, summed with decimal.js. '0' when the model is unpriced."
    },
    "currency": { "type": "string", "minLength": 1 },
    "status": {
      "type": "string",
      "enum": ["success", "error"],
      "description": "Outcome of the invocation; default 'success' for a tracked response."
    },
    "attribution_status": {
      "type": "string",
      "enum": ["complete", "partial", "missing"],
      "description": "Derived: complete when prompt+agent+session all present; missing when none; partial otherwise."
    },
    "environment": {
      "type": ["string", "null"],
      "description": "Deployment environment (development | staging | production | ...). Optional; reserved for forward compatibility."
    },
    "application_name": {
      "type": ["string", "null"],
      "description": "Name of the instrumented application. Optional."
    },
    "application_version": {
      "type": ["string", "null"],
      "description": "Version of the instrumented application. Optional."
    },
    "tenant_id": {
      "type": ["string", "null"],
      "description": "Tenant identifier for multi-tenant deployments. Optional."
    },
    "tags": {
      "type": "array",
      "items": { "type": "string" },
      "description": "Free-form labels for filtering/grouping. Defaults to []."
    },
    "correlation_id": {
      "type": ["string", "null"],
      "description": "Cross-system correlation id for distributed tracing. Optional."
    },
    "metadata": {
      "type": "object",
      "description": "Open key/value bag carried through uninterpreted (sink-specific fields, protocol_version, sdk, …). MUST carry a boolean `priced` flag: false ⇒ tokens counted but cost contributes 0.",
      "required": ["priced"],
      "properties": {
        "priced": { "type": "boolean" }
      },
      "additionalProperties": true
    },
    "raw": {
      "type": ["object", "null"],
      "description": "Optional original unmodified source record, preserved for the JSON inspector and replay. Defaults to {} when a producer has no upstream record; the platform always populates it.",
      "additionalProperties": true
    }
  }
}
