{
  "event_id": "evt-full-1",
  "timestamp": "2026-06-21T09:30:00.500+00:00",
  "provider": "openai",
  "model": "gpt-x",
  "request_id": "req-9f3",
  "session_id": "s2",
  "conversation_id": "conv-7",
  "workflow_id": "wf-beta",
  "agent": "summarizer",
  "parent_agent": "coordinator",
  "prompt": "summary",
  "prompt_hash": "ph_761b7ad8ad43",
  "prompt_version": "v3",
  "tool_name": "web_search",
  "input_tokens": 380,
  "output_tokens": 120,
  "total_tokens": 500,
  "latency_ms": 182.4,
  "cost": "0.0040",
  "currency": "USD",
  "status": "success",
  "attribution_status": "complete",
  "environment": "production",
  "application_name": "research-pipeline",
  "application_version": "2.1.0",
  "tenant_id": "tenant-acme",
  "correlation_id": "corr-abc-123",
  "tags": ["beta", "priority"],
  "metadata": { "priced": true, "protocol_version": "1.0", "sdk": "observation-sdk-python" },
  "raw": { "candidates_token_count": 90, "thoughts_token_count": 30 }
}
