{
  "event_id": "evt-partial-1",
  "timestamp": "2026-06-20T12:00:00+00:00",
  "provider": "gemini",
  "model": "gemini-3-flash-preview",
  "request_id": "evt-partial-1",
  "session_id": "s4",
  "conversation_id": null,
  "workflow_id": null,
  "agent": "analyst",
  "parent_agent": null,
  "prompt": "unknown",
  "prompt_hash": null,
  "prompt_version": null,
  "tool_name": null,
  "input_tokens": 50,
  "output_tokens": 25,
  "total_tokens": 75,
  "latency_ms": 0,
  "cost": "0.0008",
  "currency": "USD",
  "status": "success",
  "attribution_status": "partial",
  "environment": null,
  "application_name": null,
  "application_version": null,
  "tenant_id": null,
  "correlation_id": null,
  "tags": [],
  "metadata": { "priced": true },
  "raw": {}
}
