{
  "event_id": "evt-intcost-1",
  "timestamp": "2026-06-22T08:15:00+00:00",
  "provider": "anthropic",
  "model": "claude-x",
  "request_id": "evt-intcost-1",
  "session_id": "s5",
  "conversation_id": null,
  "workflow_id": null,
  "agent": "coordinator",
  "parent_agent": null,
  "prompt": "plan",
  "prompt_hash": "ph_64879f7d6b96",
  "prompt_version": null,
  "tool_name": null,
  "input_tokens": 1000000,
  "output_tokens": 500000,
  "total_tokens": 1500000,
  "latency_ms": 12000,
  "cost": "3",
  "currency": "USD",
  "status": "success",
  "attribution_status": "complete",
  "environment": null,
  "application_name": null,
  "application_version": null,
  "tenant_id": null,
  "correlation_id": null,
  "tags": [],
  "metadata": { "priced": true },
  "raw": {}
}
