{
  "event_id": "evt-unpriced-1",
  "timestamp": "2026-06-20T11:00:00+00:00",
  "provider": "local",
  "model": "llama-local",
  "request_id": "evt-unpriced-1",
  "session_id": "s3",
  "conversation_id": null,
  "workflow_id": null,
  "agent": "worker",
  "parent_agent": null,
  "prompt": "classify",
  "prompt_hash": "ph_000000000000",
  "prompt_version": null,
  "tool_name": null,
  "input_tokens": 12,
  "output_tokens": 8,
  "total_tokens": 20,
  "latency_ms": 5,
  "cost": "0",
  "currency": "USD",
  "status": "success",
  "attribution_status": "complete",
  "environment": null,
  "application_name": null,
  "application_version": null,
  "tenant_id": null,
  "correlation_id": null,
  "tags": [],
  "metadata": { "priced": false },
  "raw": {}
}
