{
  "event_id": "evt-missing-1",
  "timestamp": "2026-06-21T11:00:00+00:00",
  "provider": "gemini",
  "model": "gemini-3-flash-preview",
  "request_id": "evt-missing-1",
  "session_id": "unknown",
  "conversation_id": null,
  "workflow_id": null,
  "agent": "unknown",
  "parent_agent": null,
  "prompt": "unknown",
  "prompt_hash": null,
  "prompt_version": null,
  "tool_name": null,
  "input_tokens": 80,
  "output_tokens": 20,
  "total_tokens": 100,
  "latency_ms": 0,
  "cost": "0.0015",
  "currency": "USD",
  "status": "success",
  "attribution_status": "missing",
  "environment": null,
  "application_name": null,
  "application_version": null,
  "tenant_id": null,
  "correlation_id": null,
  "tags": [],
  "metadata": { "priced": true },
  "raw": {}
}
