{
  "event_id": "evt-min-1",
  "timestamp": "2026-06-20T10:00:00+00:00",
  "provider": "gemini",
  "model": "gemini-3-flash-preview",
  "request_id": "evt-min-1",
  "session_id": "s1",
  "conversation_id": null,
  "workflow_id": null,
  "agent": "coordinator",
  "parent_agent": null,
  "prompt": "route",
  "prompt_hash": "ph_8a84e406c08a",
  "prompt_version": null,
  "tool_name": null,
  "input_tokens": 200,
  "output_tokens": 40,
  "total_tokens": 240,
  "latency_ms": 0,
  "cost": "0.0030",
  "currency": "USD",
  "status": "success",
  "attribution_status": "complete",
  "environment": null,
  "application_name": null,
  "application_version": null,
  "tenant_id": null,
  "correlation_id": null,
  "tags": [],
  "metadata": { "priced": true },
  "raw": {}
}
